SQL> CREATE TABLE tbl_employee (
  2  eid NUMBER(5),
  3  ename VARCHAR2(20),
  4   esalary NUMBER(5)
  5  );

Table created.

SQL> INSERT INTO tbl_employee (eid, ename, esalary)
  2      VALUES (1, 'Jeeva', 5000);

1 row created.

SQL> INSERT INTO tbl_employee (eid, ename, esalary)
  2      VALUES (2, 'bharathi', 7870);

1 row created.

SQL>
SQL> INSERT INTO tbl_employee (eid, ename, esalary)
  2      VALUES (3, 'raj', 8700);

1 row created.

SQL> INSERT INTO tbl_employee (eid, ename, esalary)
  2      VALUES (3, 'kumar', 8700);

1 row created.

SQL> INSERT INTO tbl_employee (eid , ename, esalary)
  2  VALUES (4, 'mathan',9000);

1 row created.

SQL> select * from tbl_employee ;

       EID ENAME                   ESALARY
---------- -------------------- ----------
         1 Jeeva                      5000
         2 bharathi                   7870
         3 raj                       8700
         3 kumar                        8700
         4 mathan                       9000

SQL>  alter table tbl_employee add doj date;

Table altered.

SQL> select * from tbl_employee ;

       EID ENAME                   ESALARY DOJ
---------- -------------------- ---------- ---------
         1 Jeeva                      5000
         2 Bharathi                      7870
         3 raj                        8700
         3 kumar                        8700
         4 mathan                       9000

SQL>  alter table tbl_employee add dno date;

Table altered.

SQL> select * from tbl_employee ;

       EID ENAME                   ESALARY DOJ       DNO
---------- -------------------- ---------- --------- ---------
         1 Jeeva                      5000
         2 Bharathi                      7870
         3 raj                        8700
         3 kumar                        8700
         4 mathan                       9000
SQL> ALTER TABLE tbl_employee DROP COLUMN DOJ;

Table altered.

SQL> select * from tbl_employee ;

       EID ENAME                   ESALARY DNO
---------- -------------------- ---------- ---------
         1 Jeeva                      5000
         2 bharathi                      7870
         3 raj                        8700
         3 kumar                        8700
         4 mathan                       9000
SQL> ALTER TABLE tbl_employee
  2  MODIFY DNO NUMBER;

Table altered.

SQL> UPDATE tbl_employee
  2  SET DNO = 50
  3  WHERE EID IN (1, 2);

2 rows updated.

SQL> select * from tbl_employee ;

       EID ENAME                   ESALARY        DNO
---------- -------------------- ---------- ----------
         1 Jeeva                      5000         50
         2 bharathi                      7870         50
         3 raj                        8700
         3 kumar                        8700
         4 mathan                       9000

SQL> UPDATE tbl_employee
  2  SET DNO = 30
  3  WHERE EID IN (3,4);

3 rows updated.

SQL> select * from tbl_employee ;

       EID ENAME                   ESALARY        DNO
---------- -------------------- ---------- ----------
         1 Jeeva                     5000         50
         2 bharathi                      7870         50
         3 raj                        8700         30
         3 kumar                        8700         30
         4 mathan                       9000         30
SQL> select dno,count (*) from tbl_employee group by dno;

       DNO   COUNT(*)
---------- ----------
        30          3
        50          2

SQL> select dno,count (*),sum(esalary),avg(esalary),min(esalary),max(esalary)from tbl_employee group by dno;

       DNO   COUNT(*) SUM(ESALARY) AVG(ESALARY) MIN(ESALARY) MAX(ESALARY)
---------- ---------- ------------ ------------ ------------ ------------
        30          3        26400         8800         8700         9000
        50          2        12870         6435         5000         7870

SQL> select dno,count (*),sum(esalary),avg(esalary),min(esalary),max(esalary)from tbl_employee group by dno order by dno;

       DNO   COUNT(*) SUM(ESALARY) AVG(ESALARY) MIN(ESALARY) MAX(ESALARY)
---------- ---------- ------------ ------------ ------------ ------------
        30          3        26400         8800         8700         9000
        50          2        12870         6435         5000         7870

SQL> select dno,count (*),sum(esalary),avg(esalary),min(esalary),max(esalary)from tbl_employee group by dno having min(esalary) > 2000 order by dno;

       DNO   COUNT(*) SUM(ESALARY) AVG(ESALARY) MIN(ESALARY) MAX(ESALARY)
---------- ---------- ------------ ------------ ------------ ------------
        30          3        26400         8800         8700         9000
        50          2        12870         6435         5000         7870
SQL>  select dno,count (*),sum(esalary),avg(esalary),min(esalary),max(esalary)from tbl_employee group by dno having min(esalary) > 5500 order by dno;

       DNO   COUNT(*) SUM(ESALARY) AVG(ESALARY) MIN(ESALARY) MAX(ESALARY)
---------- ---------- ------------ ------------ ------------ ------------
        30          3        26400         8800         8700         9000
SQL>  select dno,count (*),sum(esalary),avg(esalary),min(esalary),max(esalary)from tbl_employee group by dno having max(esalary) > 8800 order by dno;

       DNO   COUNT(*) SUM(ESALARY) AVG(ESALARY) MIN(ESALARY) MAX(ESALARY)
---------- ---------- ------------ ------------ ------------ ------------
        30          3        26400         8800         8700         9000
SQL>  create table employee(eid number(5) primary key , ename varchar2(20), esalary number(5), dno number(5), foreign key(dno) references department(dno
));

Table created.

SQL> insert into department values (10, 'csbs');

1 row created.

SQL> insert into employee values(101,'Aathi',3000,10);

1 row created.

SQL> insert into employee values(102,'Aishu',2000,10);

1 row created.

SQL> CONNECT SYSTEM
Enter password:
Connected.
SQL> select eid,ename from tbl_employee;

       EID ENAME
---------- --------------------
         1 Jeeva
         2 bharathi
         3 raj
         3 kumar
         4 mathan

SQL> select eid as "Employee Id" , ename "Employee Name" from tbl_employee;

Employee Id Employee Name
----------- --------------------
          1 Jeeva
          2 bharathi
          3 raj
          3 kumar
          4 mathan

SQL> select dno, count(*) from tbl_employee group by dno;

       DNO   COUNT(*)
---------- ----------
        30          3
        50          2

SQL> select dno, count(*) as "Total No of Employees" from tbl_employee group by dno;

       DNO Total No of Employees
---------- ---------------------
        30                     3
        50                     2

SQL>SQL> select * from tbl_employee;

       EID ENAME                   ESALARY        DNO
---------- -------------------- ---------- ----------
         1 Jeeva                      5000
         2 bharathi                      7870
         3 raj                        8700
         3 kumar                        8700
         4 mathan                       9000

SQL> create view myview as select * from tbl_employee where dno=10;

View created.

SQL> select * from myview;

no rows selected

SQL> SELECT * FROM tbl_employee WHERE DNO = 10;

no rows selected

SQL> CREATE OR REPLACE VIEW myview AS
  2  SELECT * FROM tbl_employee
  3  WHERE DNO = 30;

View created.

SQL> SELECT * FROM myview;

       EID ENAME                   ESALARY        DNO
---------- -------------------- ---------- ----------
         3 raj                        8700         30
         3 kumar                        8700         30
         4 mathan                       9000         30

SQL> SELECT * FROM tbl_employee ;

       EID ENAME                   ESALARY        DNO
---------- -------------------- ---------- ----------
         1 Jeeva                      5000         50
         2 bharathi                      7870         50
         3 raj                        8700         30
         3 kumar                        8700         30
         4 mathan                       9000         30

SQL> drop view myview;

View dropped.